question,answer,cleaned_answer
do you have information about flu shot,summary : flu is a respiratory infection caused by a number of viruses. most people with the flu get better on their own. but it can be serious. it can cause complications and sometimes even death. getting the flu vaccine every year is the best way to lower your chance of getting the flu and spreading it to others.    the flu vaccine causes antibodies to develop in your body about two weeks after you get it. these antibodies provide protection against infection with the viruses that are in the vaccine.    flu vaccines can either be shots or nasal sprays. there is also a high-dose version for people 65 and older. ask your health care provider which one is right for you.    everyone 6 months of age and older should get a flu vaccine every season. people with egg allergies should check with their doctors before getting a vaccine. other exceptions are people who have       - had reactions to flu shots before    - guillain-barre syndrome    - a fever       centers for disease control and prevention,"The flu vaccine is the best way to lower your chance of getting the flu and spreading it to others. It causes antibodies to develop in your body about two weeks after you get it, providing protection against infection with the viruses in the vaccine. There are different types of flu vaccines, including shots and nasal sprays, and a high-dose version for people 65 and older. Everyone 6 months of age and older should get a flu vaccine every season, but people with certain health conditions or allergies should check with their doctor first."
do you have information about fluid and electrolyte balance,"summary : electrolytes are minerals in your body that have an electric charge. they are in your blood, urine and body fluids. maintaining the right balance of electrolytes helps your body's blood chemistry, muscle action and other processes. sodium, calcium, potassium, chlorine, phosphate and magnesium are all electrolytes. you get them from the foods you eat and the fluids you drink.    levels of electrolytes in your body can become too low or too high. that can happen when the amount of water in your body changes, causing dehydration or overhydration. causes include some medicines, vomiting, diarrhea, sweating or kidney problems. problems most often occur with levels of sodium, potassium or calcium.","Electrolytes are minerals with an electric charge, found in blood, urine, and body fluids. Maintaining the right balance of electrolytes helps with blood chemistry, muscle action, and other processes. Sodium, calcium, potassium, chlorine, phosphate, and magnesium are all electrolytes, obtained from food and drink."
do you have information about folic acid,"summary : folic acid is a b vitamin. it helps the body make healthy new cells. everyone needs folic acid. for women who may get pregnant, it is really important. getting enough folic acid before and during pregnancy can prevent major birth defects of her baby's brain or spine.     foods with folic acid in them include       - leafy green vegetables    - fruits    - dried beans, peas, and nuts    - enriched breads, cereals and other grain products       if you don't get enough folic acid from the foods you eat, you can also take it as a dietary supplement.    nih: national institutes of health office of dietary supplements","Folic acid is a B vitamin that helps the body make healthy new cells. Everyone needs it, but it's especially important for women who may become pregnant to prevent major birth defects of the baby's brain or spine. Folic acid is found in leafy green vegetables, fruits, dried beans, peas, and nuts, as well as enriched breads, cereals, and other grain products."
do you have information about food labeling,"summary : most packaged foods in the u.s. have food labels. on every food label you will see       - serving size, number of servings, and number of calories per serving     - information on the amount of dietary fat, cholesterol, dietary fiber, dietary sodium, carbohydrates, dietary proteins, vitamins, and minerals in each serving     -  definitions for terms such as low-fat and high-fiber     - information to help you see how a food fits into an overall daily diet        food and drug administration","Packaged foods in the U.S. have food labels that include serving size, number of servings, and calories per serving. The labels also provide information on dietary fat, cholesterol, fiber, sodium, carbohydrates, proteins, vitamins, and minerals, as well as definitions for terms like ""low-fat"" and ""high-fiber""."
do you have information about food safety,"summary : safe steps in food handling, cooking, and storage can prevent foodborne illness. there are four basic steps to food safety at home:       - clean - always wash your fruits and vegetables, hands, counters, and cooking utensils.    - separate - keep raw foods to themselves. germs can spread from one food to another.    - cook - foods need to get hot and stay hot. heat kills germs.    - chill - put fresh food in the refrigerator right away.       in the grocery store, avoid cans that are bulging or jars that have cracks or loose lids. check packages to be sure food hasn't reached its expiration date.    united states department of agriculture","Safe steps in food handling, cooking, and storage can prevent foodborne illness. The four basic steps to food safety at home are: clean, separate, cook, and chill. Clean by washing fruits and vegetables, hands, counters, and utensils. Separate raw foods to prevent germ spread. Cook foods to a hot temperature to kill germs. Chill fresh food in the refrigerator right away."
do you have information about foot health,"summary : each step you take involves a complex network of bones, muscles, tendons, and ligaments. this, combined with all of the weight they carry, explains why feet can have problems. to keep your feet healthy       -  examine your feet regularly    -  wear comfortable shoes that fit    -  wash your feet daily with soap and lukewarm water     -  trim your toenails straight across and not too short       your foot health can be a clue to your overall health. for example, joint stiffness could mean arthritis. tingling or numbness could be a sign of diabetes. swelling might indicate kidney disease, heart disease, or high blood pressure.    good foot care and regular foot checks are an important part of your health care. if you have foot problems, be sure to talk to your doctor.     nih: national institute on aging","Each step you take involves a complex network of bones, muscles, tendons, and ligaments, making feet prone to problems. To keep your feet healthy, examine them regularly, wear comfortable shoes, wash them daily, and trim your toenails straight across. Your foot health can also be a clue to your overall health, with issues like joint stiffness, tingling or numbness, or swelling potentially indicating underlying conditions. Good foot care and regular checks are essential for overall health."
do you have information about genes and gene therapy,"summary : genes are the building blocks of inheritance. passed from parent to child, they contain instructions for making proteins. if genes don't produce the right proteins or don't produce them correctly, a child can have a genetic disorder.     gene therapy is an experimental technique that uses genes to treat or prevent disease. the most common form of gene therapy involves inserting a normal gene to replace an abnormal gene. other approaches include       -  swapping an abnormal gene for a normal one    -  repairing an abnormal gene    -  altering the degree to which a gene is turned on or off       although there is much hope for gene therapy, it is still experimental.     genetics home reference","Genes are the building blocks of inheritance, containing instructions for making proteins. If genes don't produce the right proteins or don't produce them correctly, a child can have a genetic disorder. Gene therapy is an experimental technique that uses genes to treat or prevent disease, often by inserting a normal gene to replace an abnormal one."
do you have information about genetic counseling,"summary : genetic counseling provides information and support to people who have, or may be at risk for, genetic disorders. a genetic counselor meets with you to discuss genetic risks. the counseling may be for yourself or a family member. or you may get it when you are planning or expecting a baby. you may follow up with genetic testing.     there are many reasons to seek genetic counseling. you may consider it if you        - have a personal or family history of a genetic condition or birth defect    - are pregnant or planning to be pregnant after age 35    - already have a child with a genetic disorder or birth defect    - have had two or more pregnancy losses or a baby who died    - have had ultrasound or screening tests that suggest a possible problem       genetics home reference","Genetic counseling provides information and support to individuals who have or may be at risk for genetic disorders. A genetic counselor discusses genetic risks with you, which may be for yourself or a family member, or when planning or expecting a baby. You may also consider genetic testing. Reasons to seek genetic counseling include a personal or family history of a genetic condition, being pregnant or planning to be pregnant after age 35, having a child with a genetic disorder, or having had ultrasound or screening tests that suggest a possible problem."
do you have information about genetic testing,"summary : genetic tests are tests on blood and other tissue to find genetic disorders. over 2000 tests are available. doctors use genetic tests for several reasons. these include       - finding genetic diseases in unborn babies    - finding out if people carry a gene for a disease and might pass it on to their children    - screening embryos for disease     - testing for genetic diseases in adults before they cause symptoms    - making a diagnosis in a person who has disease symptoms    - figuring out the type or dose of a medicine that is best for a certain person       people have many different reasons for being tested or not being tested. for some, it is important to know whether a disease can be prevented or treated if a test is positive. in some cases, there is no treatment. but test results might help a person make life decisions, such as family planning or insurance coverage. a genetic counselor can provide information about the pros and cons of testing.    nih: national human genome research institute","Genetic tests are used to identify genetic disorders and are available for over 2000 tests. Doctors use them for various reasons, including finding genetic diseases in unborn babies, identifying carriers of a disease, and making a diagnosis in adults. The results can help individuals make life decisions, such as family planning or insurance coverage, and a genetic counselor can provide information on the pros and cons of testing."
do you have information about germs and hygiene,"summary : when you cough or sneeze, you send tiny germ-filled droplets into the air. colds and flu usually spread that way. you can help stop the spread of germs by       - covering your mouth and nose when you sneeze or cough. sneeze or cough into your elbow, not your hands.    - cleaning your hands often - always before you eat or prepare food, and after you use the bathroom or change a diaper     - avoiding touching your eyes, nose or mouth       hand washing is one of the most effective and most overlooked ways to stop disease. soap and water work well to kill germs. wash for at least 20 seconds and rub your hands briskly. disposable hand wipes or gel sanitizers also work well.","When you cough or sneeze, you release tiny droplets into the air that can spread colds and flu. To stop the spread of germs, cover your mouth and nose, sneeze or cough into your elbow, and wash your hands often, especially before eating or using the bathroom. Soap and water are effective in killing germs, and you should wash your hands for at least 20 seconds."
do you have information about gun safety,"summary : many u.s. households have guns, but they can cause harm if not handled properly. here are some things you can do to keep yourself and your family safe:       - teach children that they shouldn't touch guns and that if they see a gun, to leave it alone and tell an adult.     - if your children play at another home, talk to the parents about gun safety.     - treat every gun as if it were loaded.     - always store guns unloaded.     - lock guns in a rack or safe, and hide the keys or combination.     - store ammunition away from guns and keep it locked.     - don't keep guns in your home if someone in your family has a mental illness, severe depression, or potential for violence.","Teach children not to touch guns and to leave them alone if they see one. If they play at another home, discuss gun safety with the parents. Always treat guns as if they're loaded, store them unloaded, and lock them away."
do you have information about hazardous waste,"summary : even if you use them properly, many chemicals can still harm human health and the environment. when you throw these substances away, they become hazardous waste. some hazardous wastes come from products in our homes. our garbage can include such hazardous wastes as old batteries, bug spray cans and paint thinner. u.s. residents generate 1.6 million tons of household hazardous waste per year. hazardous waste is also a by-product of manufacturing.     you may have hazardous wastes in your basement or garage. how do you get rid of them? don't pour them down the drain, flush them, or put them in the garbage. see if you can donate or recycle. many communities have household hazardous waste collection programs. check to see if there is one in your area.    environmental protection agency","Many chemicals can harm human health and the environment, even when used properly. Hazardous waste is created when these substances are thrown away, and it can come from products in our homes, such as old batteries, bug spray cans, and paint thinner."
do you have information about health facilities,"summary : health facilities are places that provide health care. they include hospitals, clinics, outpatient care centers, and specialized care centers, such as birthing centers and psychiatric care centers.    when you choose a health facility, you might want to consider       - how close it is to where you live or work    - whether your health insurance will pay for services there    - whether your health care provider can treat you there    - the quality of the facility       quality is important. some facilities do a better job than others. one way to learn about the quality of a facility is to look at report cards developed by federal, state, and consumer groups.","Health facilities are places that provide healthcare, including hospitals, clinics, and specialized care centers. When choosing a facility, consider factors such as proximity, insurance coverage, provider availability, and quality."
do you have information about health fraud,"summary : health fraud involves selling drugs, devices, foods, or cosmetics that have not been proven effective. keep in mind - if it sounds too good to be true, it's probably a scam. at best, these scams don't work. at worst, they're dangerous. they also waste money, and they might keep you from getting the treatment you really need.    health fraud scams can be found everywhere, promising help for many common health issues, including weight loss, memory loss, sexual performance, and joint pain. they target people with serious conditions like cancer, diabetes, heart disease, hiv/aids, arthritis, alzheimer's, and many more.    to protect yourself, recognize the red flags such as:       - miracle cure    - quick fix    - ancient remedy    - secret ingredient    - scientific breakthrough       before taking an unproven or little known treatment, talk to a doctor or health care professional - especially when taking prescription drugs.    food and drug administration","Health fraud involves selling unproven or ineffective products, such as drugs, devices, foods, or cosmetics, that claim to cure various health issues. These scams often target people with serious conditions and promise quick fixes, miracle cures, or ancient remedies. To protect yourself, recognize red flags like ""too good to be true"" claims and consult a doctor or healthcare professional before trying unproven treatments."
do you have information about health insurance,"summary : health insurance helps protect you from high medical care costs. it is a contract between you and your insurance company. you buy a plan or policy, and the company agrees to pay part of your expenses when you need medical care.    many people in the united states get a health insurance policy through their employers. in most cases, the employer helps pay for that insurance. insurance through employers is often with a managed care plan. these plans contract with health care providers and medical facilities to provide care for members at reduced costs. you can also purchase health insurance on your own.    people who meet certain requirements can qualify for government health insurance, such as medicare and medicaid. the affordable care act expands health insurance coverage for many people in the u.s.","Health insurance helps protect you from high medical care costs by paying part of your expenses when you need medical care. You can buy a plan or policy from an insurance company, and they will agree to pay a portion of your expenses. Many people get health insurance through their employers, who often help pay for it. You can also purchase insurance on your own, or qualify for government programs like Medicare and Medicaid if you meet certain requirements."
do you have information about health literacy,"summary : health literacy refers to how well a person can get the health information and services that they need, and how well they understand them. it is also about using them to make good health decisions. it involves differences that people have in areas such as       - access to information that they can understand    - skills, such as finding that information, communicating with health care providers, living a healthy lifestyle, and managing a disease    - knowledge of medical words, and of how their healthcare system works    - abilities, such as physical or mental limitations    - personal factors, such as age, education, language abilities, and culture       more than 90 million adults in the united states have low health literacy. it affects their ability to make health decisions. this can harm their health. they may have trouble managing chronic diseases, and leading a healthy lifestyle. they may go to the hospital more often, and have poorer health overall.    nih: national institutes of health","Health literacy refers to a person's ability to access, understand, and use health information and services to make informed decisions. It involves differences in areas such as access to information, skills, knowledge, abilities, and personal factors. Over 90 million adults in the US have low health literacy, which can harm their health by affecting their ability to manage chronic diseases, lead a healthy lifestyle, and make informed decisions."
do you have information about health occupations,"summary : every day, around the clock, people who work in the health care industry provide care for millions of people, from newborns to the very ill. in fact, the health care industry is one of largest providers of jobs in the united states. many health jobs are in hospitals. others are in nursing homes, doctors' offices, dentists' offices, outpatient clinics and laboratories.    to work in a health occupation, you often must have special training. some, like doctors, must have more than 4 years of college.    bureau of labor statistics","People in the health care industry provide care for millions, from newborns to the very ill. The industry is one of the largest job providers in the US, with many jobs in hospitals, nursing homes, doctors' offices, and more. Special training is often required, with some jobs, like doctors, needing more than 4 years of college."
do you have information about health screening,"summary : screenings are tests that look for diseases before you have symptoms. screening tests can find diseases early, when they're easier to treat. you can get some screenings in your doctor's office. others need special equipment, so you may need to go to a different office or clinic.    some conditions that doctors commonly screen for include       - breast cancer and cervical cancer in women    - colorectal cancer    - diabetes    - high blood pressure    - high cholesterol    - osteoporosis    - overweight and obesity    - prostate cancer in men       which tests you need depends on your age, your sex, your family history, and whether you have risk factors for certain diseases. after a screening test, ask when you will get the results and whom to talk to about them.    agency for healthcare research and quality","Screenings are tests that look for diseases before symptoms appear. They can find diseases early, when they're easier to treat. Some common conditions screened for include breast and cervical cancer in women, colorectal cancer, diabetes, high blood pressure, high cholesterol, osteoporosis, overweight and obesity, and prostate cancer in men. The tests you need depend on your age, sex, family history, and risk factors."
do you have information about health statistics,"summary : you see them all the time in the news - the number of people who were in the hospital last year, the percentage of kids who are overweight, the rate at which people are catching the flu, the average cost of a medical procedure. these are all types of health statistics.    health statistics are numbers about some aspect of health. statistics about births, deaths, marriages, and divorces are sometimes called ""vital statistics."" researchers use statistics to see patterns of diseases in groups of people. this can help in figuring out who is at risk for certain diseases, finding ways to control diseases and deciding which diseases should be studied.","Health statistics are numbers about some aspect of health, such as hospitalizations, obesity rates, flu cases, and medical procedure costs. Researchers use statistics to identify patterns of diseases in groups of people, helping to determine who is at risk, find ways to control diseases, and decide which diseases to study."
do you have information about healthy aging,"summary : people in the u.s. are living longer than ever before. many seniors live active and healthy lives. but there's no getting around one thing: as we age, our bodies and minds change. there are things you can do to stay healthy and active as you age:       - eat a balanced diet    - keep your mind and body active    - don't smoke    - get regular checkups    - practice safety habits to avoid accidents and prevent falls       nih: national institute on aging","Many seniors live active and healthy lives, but as we age, our bodies and minds change. To stay healthy and active, eat a balanced diet, keep your mind and body active, don't smoke, get regular checkups, and practice safety habits."
do you have information about healthy living,"summary : many factors affect your health. some you cannot control, such as your genetic makeup or your age. but you can make changes to your lifestyle. by taking steps toward healthy living, you can help reduce your risk of heart disease, cancer, stroke and other serious diseases:       - get the screening tests you need    - maintain a healthy weight    - eat a variety of healthy foods, and limit calories and saturated fat    - be physically active    - control your blood pressure and cholesterol    - don't smoke    - protect yourself from too much sun    - drink alcohol in moderation, or don't drink at all       agency for healthcare research and quality","Many factors affect your health, but you can make changes to your lifestyle to reduce your risk of serious diseases. This includes getting regular screening tests, maintaining a healthy weight, eating a variety of healthy foods, being physically active, controlling blood pressure and cholesterol, not smoking, protecting yourself from too much sun, and drinking alcohol in moderation."
