question,answer,cleaned_answer
are certain people at risk of getting vancomycinresistant enterococci?,"on this page general information what is vancomycin-resistant enterococci? what types of infections does vancomycin-resistant enterococci cause? are certain people at risk of getting vancomycin-resistant enterococci? what is the treatment for vancomycin-resistant enterococci? how is vancomycin-resistant enterococci spread? how can patients prevent the spread of vancomycin-resistant enterococci? what should a patient do if they think they have vancomycin-resistant enterococci? recommendations and guidelines general information for more images of this bacterium, search the public health image library what is vancomycin-resistant enterococci? enteroccocci are bacteria that are normally present in the human intestines and in the female genital tract and are often found in the environment. these bacteria can sometimes cause infections. vancomycin is an antibiotic that is used to treat some drug-resistant infections caused by enterococci. in some instances, enterococci have become resistant to this drug and thus are called vancomycin-resistant enterococci (vre). most vre infections occur in hospitals. top of page what types of infections does vre cause? vre can live in the human intestines and female genital tract without causing disease (often called colonization). however, sometimes it can cause infections of the urinary tract, the bloodstream, or of wounds associated with catheters or surgical procedures. top of page are certain people at risk of getting vre? the following persons are at increased risk becoming infected with vre: people who have been previously treated with the antibiotic vancomycin or other antibiotics for long periods of time. people who are hospitalized, particularly when they receive antibiotic treatment for long periods of time. people with weakened immune systems such as patients in intensive care units, or in cancer or transplant wards. people who have undergone surgical procedures such as abdominal or chest surgery. people with medical devices that stay in for some time such as urinary catheters or central intravenous (iv) catheters. people who are colonized with vre. top of page what is the treatment for vre? people with colonized vre (bacteria are present, but have no symptoms of an infection)  do not need treatment. most vre infections can be treated with antibiotics other than vancomycin. laboratory testing of the vre can determine which antibiotics will work. for people who get vre infections in their bladder and have urinary catheters, removal of the catheter when it is no longer needed can also help get rid of the infection. top of page how is vre spread? vre is often passed from person to person by the contaminated hands of caregivers. vre can get onto a caregiver's hands after they have contact with other people with vre or after contact with contaminated surfaces. vre can also be spread directly to people after they touch surfaces that are contaminated with vre. vre is not spread through the air by coughing or sneezing. top of page how can patients prevent the spread of vre? if a patient or someone in their household has vre, the following are some things they can do to prevent the spread of vre: keep their hands clean. always wash their hands thoroughly after using the bathroom and before preparing food. clean their hands after contact with persons who have vre. wash with soap and water (particularly when visibly soiled) or use alcohol-based hand rubs. frequently clean areas of the home, such as bathrooms, that may become contaminated with vre. wear gloves if hands may come in contact with body fluids that may contain vre, such as stool or bandages from infected wounds. always wash their hands after removing gloves. if someone has vre, be sure to tell healthcare providers so that they are aware of the infection. healthcare facilities use special precautions to help prevent the spread of vre to others. top of page what should patients do if they think they have vancomycin-resistant enterococci (vre)? anyone who thinks they have vre must talk with their healthcare provider. top of page recommendations and guidelines for more information about prevention and treatment of hais, see the resources below: siegel jd, rhinehart e, jackson m, et al. the healthcare infection control practices advisory committee (hicpac). management of multidrug-resistant organisms in healthcare settings, 2006","Certain people are at increased risk of getting vancomycin-resistant enterococci (VRE). These include:

* People who have been previously treated with antibiotics for long periods of time
* Hospitalized patients, especially those receiving antibiotic treatment
* Those with weakened immune systems, such as patients in intensive care units or cancer or transplant wards
* Those who have undergone surgical procedures or have medical devices inserted
* Those who are colonized with VRE"
are there complications from botulism?,"botulism can result in death due to respiratory failure. however, in the past 50 years the proportion of patients with botulism who die has fallen from about 50% to 3-5%. a patient with severe botulism may require a breathing machine as well as intensive medical and nursing care for several months, and some patients die from infections or other problems related to remaining paralyzed for weeks or months. patients who survive an episode of botulism poisoning may have fatigue and shortness of breath for years and long-term therapy may be needed to aid recovery.","Botulism can result in death from respiratory failure, but this has decreased significantly over the past 50 years. Patients with severe botulism may require a breathing machine and intensive care for several months, and some may die from related infections or complications. Survivors may experience fatigue and shortness of breath for years, requiring long-term therapy."
do you have information about a1c,"summary : a1c is a blood test for type 2 diabetes and prediabetes. it measures your average blood glucose, or blood sugar, level over the past 3 months. doctors may use the a1c alone or in combination with other diabetes tests to make a diagnosis. they also use the a1c to see how well you are managing your diabetes. this test is different from the blood sugar checks that people with diabetes do every day.    your a1c test result is given in percentages. the higher the percentage, the higher your blood sugar levels have been:       - a normal a1c level is below 5.7 percent    - prediabetes is between 5.7 to 6.4 percent. having prediabetes is a risk factor for getting type 2 diabetes. people with prediabetes may need retests every year.    - type 2 diabetes is above 6.5 percent    - if you have diabetes, you should have the a1c test at least twice a year. the a1c goal for many people with diabetes is below 7. it may be different for you. ask what your goal should be. if your a1c result is too high, you may need to change your diabetes care plan.       nih: national institute of diabetes and digestive and kidney diseases","A1c is a blood test that measures your average blood glucose level over 3 months. It's used to diagnose type 2 diabetes and prediabetes, and to monitor how well you're managing your diabetes. The result is given in percentages, with a normal level below 5.7%, prediabetes between 5.7-6.4%, and type 2 diabetes above 6.5%."
do you have information about acupuncture,"summary : acupuncture has been practiced in china and other asian countries for thousands of years. acupuncture involves stimulating specific points on the body. this is most often done by inserting thin needles through the skin, to cause a change in the physical functions of the body.    research has shown that acupuncture reduces nausea and vomiting after surgery and chemotherapy. it can also relieve pain. researchers don't fully understand how acupuncture works. it might aid the activity of your body's pain-killing chemicals. it also might affect how you release chemicals that regulate blood pressure and flow.    nih: national center for complementary and integrative health","Acupuncture has been practiced in China and other Asian countries for thousands of years. It involves stimulating specific points on the body, often by inserting thin needles, to cause a change in physical functions. Research has shown it reduces nausea and vomiting after surgery and chemotherapy, and relieves pain."
do you have information about adoption,"summary : adoption brings a child born to other parents into a new family. birth parents have a number of reasons for placing children for adoption. overall, they want better lives for their children than they think they can give them.    children who are eligible for adoption come from many different settings. some are in foster care, a temporary home setting. other children live in orphanages or with birth relatives until they can be adopted.    there are different kinds of adoption. children may be adopted by a relative or a new family. some parents adopt children from the u.s, and some adopt from abroad.","Adoption brings a child born to other parents into a new family. Birth parents place children for adoption to provide a better life for them than they can give. Children eligible for adoption come from various settings, including foster care, orphanages, or birth relatives. There are different types of adoption, including adoption by relatives or new families, and adoption from the U.S. or abroad."
do you have information about advance directives,"summary : what kind of medical care would you want if you were too ill or hurt to express your wishes? advance directives are legal documents that allow you to spell out your decisions about end-of-life care ahead of time. they give you a way to tell your wishes to family, friends, and health care professionals and to avoid confusion later on.     a living will tells which treatments you want if you are dying or permanently unconscious. you can accept or refuse medical care. you might want to include instructions on       - the use of dialysis and breathing machines    -  if you want to be resuscitated if your breathing or heartbeat stops     -  tube feeding    -  organ or tissue donation         a durable power of attorney for health care is a document that names your health care proxy. your proxy is someone you trust to make health decisions for you if you are unable to do so.     nih: national cancer institute","Advance directives are legal documents that allow you to spell out your decisions about end-of-life care ahead of time. They include a living will, which outlines your wishes for medical care if you are dying or permanently unconscious, and a durable power of attorney for health care, which names a proxy to make health decisions for you if you are unable to do so."
do you have information about african american health,"summary : every racial or ethnic group has specific health concerns. differences in the health of groups can result from       - genetics    - environmental factors    - access to care    - cultural factors        on this page, you'll find links to health issues that affect african americans.","African Americans have specific health concerns due to genetics, environmental factors, access to care, and cultural factors."
do you have information about air pollution,"summary : air pollution is a mixture of solid particles and gases in the air. car emissions, chemicals from factories, dust, pollen and mold spores may be suspended as particles. ozone, a gas, is a major part of air pollution in cities. when ozone forms air pollution, it's also called smog.    some air pollutants are poisonous. inhaling them can increase the chance you'll have health problems. people with heart or lung disease, older adults and children are at greater risk from air pollution. air pollution isn't just outside - the air inside buildings can also be polluted and affect your health.    environmental protection agency","Air pollution is a mixture of solid particles and gases in the air, including car emissions, chemicals from factories, dust, pollen, and mold spores. Ozone, a gas, is a major part of air pollution in cities, also known as smog. Some air pollutants are poisonous, increasing the risk of health problems, especially for people with heart or lung disease, older adults, and children."
do you have information about alcohol,"summary : if you are like many americans, you drink alcohol at least occasionally. for many people, moderate drinking is probably safe. it may even have health benefits, including reducing your risk of certain heart problems. for most women and for most people over 65, moderate drinking is no more than three drinks a day or seven drinks per week. for men under 65, it is no more than four drinks a day or 14 drinks per week.    some people should not drink at all, including alcoholics, children, pregnant women, people taking certain medicines, and people with certain medical conditions. if you have questions about whether it is safe for you to drink, speak with your health care provider.    anything more than moderate drinking can be risky. heavy drinking can lead to alcoholism and alcohol abuse, as well as injuries, liver disease, heart disease, cancer, and other health problems. it can also cause problems at home, at work, and with friends.    nih: national institute on alcohol abuse and alcoholism","For many people, moderate drinking is probably safe, and may even have health benefits. Moderate drinking is defined as no more than three drinks a day or seven drinks per week for most women and people over 65, and no more than four drinks a day or 14 drinks per week for men under 65. However, some people should not drink at all, including those with certain medical conditions or taking certain medicines."
do you have information about anabolic steroids,"summary : anabolic steroids are man-made substances related to male sex hormones. doctors use anabolic steroids to treat some hormone problems in men, delayed puberty, and muscle loss from some diseases.    bodybuilders and athletes often use anabolic steroids to build muscles and improve athletic performance. using them this way is not legal or safe. abuse of anabolic steroids has been linked with many health problems. they include       -  acne    -  breast growth and shrinking of testicles in men     - voice deepening and growth of facial hair in women     - high blood pressure    - heart problems, including heart attack    - liver disease, including cancer    - kidney damage    - aggressive behavior        nih: national institute on drug abuse","Anabolic steroids are man-made substances related to male sex hormones. They are used to treat hormone problems, delayed puberty, and muscle loss from some diseases. Bodybuilders and athletes often use them to build muscles and improve athletic performance, but this is not legal or safe."
do you have information about anatomy,"summary : anatomy is the science that studies the structure of the body. on this page, you'll find links to descriptions and pictures of the human body's parts and organ systems from head to toe.",Anatomy is the science that studies the structure of the body.
do you have information about angioplasty,"summary : if you have coronary artery disease, the arteries in your heart are narrowed or blocked by a sticky material called plaque. angioplasty is a procedure to restore blood flow through the artery.    you have angioplasty in a hospital. the doctor threads a thin tube through a blood vessel in the arm or groin up to the involved site in the artery. the tube has a tiny balloon on the end. when the tube is in place, the doctor inflates the balloon to push the plaque outward against the wall of the artery. this widens the artery and restores blood flow.    doctors may use angioplasty to       - reduce chest pain caused by reduced blood flow to the heart    - minimize damage to heart muscle from a heart attack       many people go home the day after angioplasty, and are able to return to work within a week of coming home.    nih: national heart, lung, and blood institute","Angioplasty is a procedure to restore blood flow through a narrowed or blocked artery in the heart. A thin tube with a tiny balloon on the end is inserted through a blood vessel and guided to the affected area. The balloon is inflated to push plaque outward against the artery wall, widening the artery and restoring blood flow."
do you have information about antibiotic resistance,"summary : antibiotics are medicines that fight bacterial infections. used properly, they can save lives. but there is a growing problem of antibiotic resistance. it happens when bacteria change and become able to resist the effects of an antibiotic.     using antibiotics can lead to resistance. each time you take antibiotics, sensitive bacteria are killed. but resistant germs may be left to grow and multiply. they can spread to other people. they can also cause infections that certain antibiotics cannot cure. methicillin-resistant staphylococcus aureus (mrsa) is one example. it causes infections that are resistant to several common antibiotics.    to help prevent antibiotic resistance       - don't use antibiotics for viruses like colds or flu. antibiotics don't work on viruses.    - don't pressure your doctor to give you an antibiotic.     - when you take antibiotics, follow the directions carefully. finish your medicine even if you feel better. if you stop treatment too soon, some bacteria may survive and re-infect you.    - don't save antibiotics for later or use someone else's prescription.       centers for disease control and prevention","Antibiotics are medicines that fight bacterial infections, but there is a growing problem of antibiotic resistance. This occurs when bacteria change and become resistant to the effects of an antibiotic. Using antibiotics can lead to resistance, as sensitive bacteria are killed, while resistant germs may be left to grow and multiply. To help prevent antibiotic resistance, don't use antibiotics for viruses, don't pressure your doctor for an antibiotic, follow the directions carefully when taking antibiotics, and don't save antibiotics for later or use someone else's prescription."
do you have information about antibiotics,"summary : antibiotics are powerful medicines that fight bacterial infections. used properly, antibiotics can save lives. they either kill bacteria or keep them from reproducing. your body's natural defenses can usually take it from there.     antibiotics do not fight infections caused by viruses, such as       - colds     - flu     - most coughs and bronchitis     - sore throats, unless caused by strep        if a virus is making you sick, taking antibiotics may do more harm than good. using antibiotics when you don't need them, or not using them properly, can add to antibiotic resistance. this happens when bacteria change and become able to resist the effects of an antibiotic.    when you take antibiotics, follow the directions carefully. it is important to finish your medicine even if you feel better. if you stop treatment too soon, some bacteria may survive and re-infect you. do not save antibiotics for later or use someone else's prescription.     centers for disease control and prevention","Antibiotics are powerful medicines that fight bacterial infections by killing or preventing bacteria from reproducing. They do not work against viral infections, such as colds, flu, and most coughs and bronchitis. Using antibiotics when not needed or not following directions can lead to antibiotic resistance, where bacteria become resistant to the medicine. It's essential to follow the directions carefully and finish the medicine even if you feel better to avoid re-infection."
do you have information about antidepressants,"summary : antidepressants are medicines that treat depression. your doctor can prescribe them for you. they work to balance some of the natural chemicals in our brains. it may take several weeks for them to help. there are several types of antidepressants. you and your doctor may have to try a few before finding what works best for you.    antidepressants may cause mild side effects that usually do not last long. these may include headache, nausea, sleep problems, restlessness, and sexual problems. tell your doctor if you have any side effects. you should also let your doctor know if you take any other medicines, vitamins, or herbal supplements.    it is important to keep taking your medicines, even if you feel better. do not stop taking your medicines without talking to your doctor. you often need to stop antidepressants gradually.    nih: national institute of mental health","Antidepressants are medicines that treat depression by balancing natural chemicals in the brain. They may take several weeks to work and come in different types. It may take trying a few before finding the right one. Mild side effects are common, such as headache, nausea, and sleep problems, but usually don't last long. It's important to keep taking the medicine as prescribed and not stop without talking to your doctor."
do you have information about antioxidants,"summary : antioxidants are man-made or natural substances that may prevent or delay some types of cell damage. antioxidants are found in many foods, including fruits and vegetables. they are also available as dietary supplements. examples of antioxidants include       -  beta-carotene     -  lutein     -  lycopene    -  selenium    -  vitamin a    -  vitamin c    -  vitamin e       vegetables and fruits are rich sources of antioxidants. there is good evidence that eating a diet with lots of vegetables and fruits is healthy and lowers risks of certain diseases. but it isn't clear whether this is because of the antioxidants, something else in the foods, or other factors.    high-dose supplements of antioxidants may be linked to health risks in some cases. for example, high doses of beta-carotene may increase the risk of lung cancer in smokers. high doses of vitamin e may increase risks of prostate cancer and one type of stroke. antioxidant supplements may also interact with some medicines. to minimize risk, tell you of your health care providers about any antioxidants you use.    nih: national center for complementary and integrative health","Antioxidants are man-made or natural substances that may prevent or delay cell damage. They are found in many foods, including fruits and vegetables, and are also available as dietary supplements. Examples of antioxidants include beta-carotene, lutein, lycopene, selenium, vitamin A, vitamin C, and vitamin E. While eating a diet rich in vegetables and fruits is healthy, it's unclear whether this is due to the antioxidants or other factors. High-dose supplements may be linked to health risks, and interacting with medicines is also a concern."
do you have information about arsenic,"summary : arsenic is a natural element found in soil and minerals. arsenic compounds are used to preserve wood, as pesticides, and in some industries. arsenic can get into air, water, and the ground from wind-blown dust. it may also get into water from runoff.     you may be exposed to arsenic by       - taking in small amounts in food, drinking water, or air     - breathing sawdust or burning smoke from arsenic-treated wood     - living in an area with high levels of arsenic in rock    - working in a job where arsenic is made or used       exposure to arsenic can cause many health problems. being exposed to low levels for a long time can change the color of your skin. it can cause corns and small warts. exposure to high levels of arsenic can cause death.    agency for toxic substances disease registry","Arsenic is a natural element found in soil and minerals. It can get into air, water, and ground from wind-blown dust or runoff. Exposure to arsenic can occur through food, water, air, sawdust, or burning smoke from treated wood, or living/working in areas with high levels of arsenic in rock. Prolonged exposure can cause skin discoloration, corns, and warts, while high levels can be fatal."
do you have information about artificial limbs,"summary : people can lose all or part of an arm or leg for a number of reasons. common ones include       - circulation problems from atherosclerosis or diabetes. they may cause you to need an amputation.    - traumatic injuries, including from traffic accidents and military combat    - cancer    - birth defects       if you are missing an arm or leg, an artificial limb can sometimes replace it. the device, which is called a prosthesis, can help you to perform daily activities such as walking, eating, or dressing. some artificial limbs let you function nearly as well as before.","People can lose an arm or leg due to various reasons such as circulation problems, traumatic injuries, cancer, or birth defects. Artificial limbs, also known as prostheses, can replace the missing limb and help with daily activities like walking, eating, or dressing, allowing for nearly normal functioning."
